{
  "$schema": "../../../schemas/reference-script-annotations.schema.json",
  "schemaVersion": "1.0.0",
  "source": {
    "status": "none",
    "path": null,
    "sha256": null
  },
  "speechText": "",
  "speechSha256": "e3b0c44298fc1c149afbf4c8996fb92427ae41e4649b934ca495991b7852b855",
  "annotations": [],
  "verification": {
    "parsed": true,
    "annotationCount": 0
  }
}
